[
  {
    "id": "safety-glasses",
    "names": { "en": "Safety glasses", "hi": "सेफ्टी चश्मा" },
    "roman": "safety chashma",
    "category": "safety",
    "use": { "en": "Protect the eyes from flying chips and dust.", "hi": "उड़ते छिलकों और धूल से आँखों की रक्षा।" },
    "usedInLessons": ["l00-ppe-and-dust"],
    "verified": true
  },
  {
    "id": "dust-mask",
    "names": { "en": "Dust mask (FFP2/FFP3)", "hi": "धूल मास्क (FFP2/FFP3)" },
    "roman": "dhool mask",
    "category": "safety",
    "use": { "en": "Keep fine wood dust out of the lungs.", "hi": "बारीक बुरादे को फेफड़ों में जाने से रोके।" },
    "usedInLessons": ["l00-ppe-and-dust"],
    "verified": true
  },
  {
    "id": "ear-protection",
    "names": { "en": "Ear protection", "hi": "कान की सुरक्षा (ईयर-मफ/प्लग)" },
    "roman": "ear muff",
    "category": "safety",
    "use": { "en": "Reduce machine noise reaching the ear.", "hi": "मशीन का शोर कान तक कम पहुँचाए।" },
    "usedInLessons": ["l00-ppe-and-dust"],
    "verified": true
  },
  {
    "id": "push-stick",
    "names": { "en": "Push stick", "hi": "पुश-स्टिक" },
    "roman": "push stick",
    "category": "safety",
    "use": { "en": "Feed the last part of a cut so the hand never nears the blade.", "hi": "कटाई का आखिरी हिस्सा धकेलें ताकि हाथ ब्लेड के पास न जाए।" },
    "usedInLessons": ["l00-machine-safety"],
    "verified": true
  },
  {
    "id": "first-aid-kit",
    "names": { "en": "First-aid kit", "hi": "फर्स्ट-एड बॉक्स" },
    "roman": "first aid box",
    "category": "safety",
    "use": { "en": "Treat cuts and injuries quickly.", "hi": "कटने और चोट का तुरंत इलाज।" },
    "usedInLessons": ["l00-workshop-setup"],
    "verified": true
  },
  {
    "id": "measuring-tape",
    "names": { "en": "Measuring tape", "hi": "इंची टेप / फीता" },
    "roman": "inchi tape",
    "category": "measuring-marking",
    "use": { "en": "Measure length and width; read both inches and mm.", "hi": "लंबाई-चौड़ाई नापें; इंच और मिमी दोनों पढ़ें।" },
    "usedInLessons": ["l02-measuring-basics"],
    "verified": true
  },
  {
    "id": "gunia",
    "names": { "en": "Try square", "hi": "गुनिया" },
    "roman": "gunia",
    "category": "measuring-marking",
    "use": { "en": "Mark and check a true 90° corner.", "hi": "सही 90° कोना बनाएँ और जाँचें।" },
    "usedInLessons": ["l02-squaring-and-marking"],
    "verified": true,
    "source": "https://www.youtube.com/watch?v=WKg0rsKPjJw"
  },
  {
    "id": "marking-gauge",
    "names": { "en": "Marking gauge", "hi": "मार्किंग गेज (रवा)" },
    "roman": "marking gauge / rava",
    "category": "measuring-marking",
    "use": { "en": "Scribe a line parallel to an edge for joints.", "hi": "किनारे के समानांतर लकीर खींचें (जोड़ों के लिए)।" },
    "usedInLessons": ["l02-squaring-and-marking"],
    "verified": false
  },
  {
    "id": "carpenter-pencil",
    "names": { "en": "Carpenter pencil", "hi": "पेंसिल" },
    "roman": "pencil",
    "category": "measuring-marking",
    "use": { "en": "Mark cut lines clearly; a sharp thin line is an accurate cut.", "hi": "कटाई की लकीर साफ लगाएँ; पतली लकीर = सही कटाई।" },
    "usedInLessons": ["l02-measuring-basics"],
    "verified": true
  },
  {
    "id": "handsaw",
    "names": { "en": "Handsaw", "hi": "आरी" },
    "roman": "aari",
    "category": "cutting",
    "use": { "en": "Cut stock to rough size by hand.", "hi": "लकड़ी को हाथ से मोटे तौर पर काटें।" },
    "usedInLessons": [],
    "verified": true,
    "source": "https://sutharsamaj.net/vishwakarma-dharma/carpenter-tools-names-in-english-hindi-urdu-and-sindhi-languages/"
  },
  {
    "id": "hand-plane",
    "names": { "en": "Hand plane", "hi": "रंदा" },
    "roman": "randa",
    "category": "planing",
    "use": { "en": "Flatten and smooth a surface; take thin shavings.", "hi": "सतह समतल व चिकनी करें; पतले छिलके उतारें।" },
    "usedInLessons": [],
    "verified": true,
    "source": "https://factdunia.com/carpenter-tools-name-in-hindi/"
  },
  {
    "id": "mallet",
    "names": { "en": "Mallet", "hi": "लकड़ी का हथौड़ा / मैलेट" },
    "roman": "mallet",
    "category": "striking",
    "use": { "en": "Strike a chisel without damaging its handle.", "hi": "छेनी पर बिना हैंडल खराब किए चोट करें।" },
    "usedInLessons": [],
    "verified": true
  },
  {
    "id": "chisel-firmer",
    "names": { "en": "Firmer chisel", "hi": "रूखनी (छेनी)" },
    "roman": "rukhani",
    "category": "chisel",
    "use": { "en": "Pare and chop wood for joints.", "hi": "जोड़ों के लिए लकड़ी छीलना और काटना।" },
    "usedInLessons": ["l00-workshop-setup"],
    "verified": true,
    "source": "https://dict.hinkhoj.com/%E0%A4%B0%E0%A5%82%E0%A4%96%E0%A4%A8%E0%A5%80-meaning-in-english.words"
  },
  {
    "id": "file-rasp",
    "names": { "en": "File / rasp", "hi": "रेती" },
    "roman": "reti",
    "category": "finishing",
    "use": { "en": "Smooth and shape edges.", "hi": "किनारों को चिकना व आकार दें।" },
    "usedInLessons": [],
    "verified": true,
    "source": "https://factdunia.com/carpenter-tools-name-in-hindi/"
  },
  {
    "id": "sharpening-stone",
    "names": { "en": "Sharpening stone", "hi": "धार का पत्थर (शान)" },
    "roman": "shaan",
    "category": "chisel",
    "use": { "en": "Hone a keen edge on chisels and plane irons.", "hi": "छेनी और रंदे के ब्लेड पर तेज़ धार लगाएँ।" },
    "usedInLessons": ["l03-sharpen-edge-tools"],
    "verified": true
  },
  {
    "id": "tenon-saw",
    "names": { "en": "Tenon saw", "hi": "टेनन आरी (छोटी दाँतेदार)" },
    "roman": "tenon aari",
    "category": "cutting",
    "use": { "en": "Fine, straight cuts for joints like tenons.", "hi": "टेनन जैसे जोड़ों के लिए बारीक, सीधी कटाई।" },
    "usedInLessons": ["l05-mortise-tenon"],
    "verified": true
  },
  {
    "id": "screwdriver",
    "names": { "en": "Screwdriver", "hi": "पेचकस" },
    "roman": "pechkas",
    "category": "fastening",
    "use": { "en": "Drive and remove screws.", "hi": "पेंच कसें और खोलें।" },
    "usedInLessons": ["l06-glue-and-fasteners"],
    "verified": true,
    "source": "https://factdunia.com/carpenter-tools-name-in-hindi/"
  },
  {
    "id": "power-drill",
    "names": { "en": "Drill / driver", "hi": "ड्रिल मशीन" },
    "roman": "drill",
    "category": "power",
    "use": { "en": "Bore pilot holes and drive screws quickly.", "hi": "पायलट छेद करें और तेज़ी से पेंच कसें।" },
    "usedInLessons": ["l06-glue-and-fasteners", "l07-drill-and-driver"],
    "verified": true
  },
  {
    "id": "circular-saw",
    "names": { "en": "Circular saw", "hi": "गोल आरी (सर्कुलर सॉ)" },
    "roman": "circular saw",
    "category": "power",
    "use": { "en": "Fast straight cuts in boards and sheet goods.", "hi": "बोर्ड और शीट में तेज़ सीधी कटाई।" },
    "usedInLessons": ["l07-circular-saw-and-jigsaw"],
    "verified": true
  },
  {
    "id": "jigsaw",
    "names": { "en": "Jigsaw", "hi": "जिगसॉ (कटर)" },
    "roman": "jigsaw",
    "category": "power",
    "use": { "en": "Curved and cut-out shapes in boards.", "hi": "बोर्ड में घुमावदार और कटे-आकार।" },
    "usedInLessons": ["l07-circular-saw-and-jigsaw"],
    "verified": true
  },
  {
    "id": "router",
    "names": { "en": "Router", "hi": "राउटर" },
    "roman": "router",
    "category": "power",
    "use": { "en": "Cut grooves, edges and profiles.", "hi": "खाँचे, किनारे और प्रोफाइल काटें।" },
    "usedInLessons": [],
    "verified": true
  },
  {
    "id": "sandpaper",
    "names": { "en": "Sandpaper / abrasive", "hi": "रेगमाल" },
    "roman": "regmaal",
    "category": "finishing",
    "use": { "en": "Smooth the surface through the grits before finishing.", "hi": "फिनिश से पहले ग्रिट क्रम से सतह चिकनी करें।" },
    "usedInLessons": ["l08-sanding-and-prep"],
    "verified": true
  },
  {
    "id": "table-saw",
    "names": { "en": "Table saw / patti saw", "hi": "टेबल आरी / पट्टी आरी" },
    "roman": "patti aari",
    "category": "machine",
    "use": { "en": "Rip and cross-cut boards to size.", "hi": "बोर्ड को नाप के अनुसार चीरना और काटना।" },
    "usedInLessons": ["l00-machine-safety"],
    "verified": false
  }
]
